{
  "id": "sit_solar_farm_01",
  "organization_id": "org_greenenergy_corp",
  "name": "Sunshine Valley Solar Farm",
  "description": "50MW solar photovoltaic generation facility with battery storage",
  "type": "generation",
  "location": {
    "latitude": 35.2271,
    "longitude": -119.0193,
    "altitude": 320,
    "timezone": "America/Los_Angeles",
    "address": {
      "street": "5000 Solar Drive",
      "city": "Bakersfield",
      "state": "CA",
      "postal_code": "93301",
      "country": "USA"
    }
  },
  "area_m2": 200000,
  "grid_connection": {
    "utility": "Pacific Gas & Electric",
    "utility_account_id": "PGE-12345678",
    "connection_type": "grid_export",
    "voltage_level_kv": 115,
    "max_import_kw": 1000,
    "max_export_kw": 50000,
    "interconnection_date": "2021-06-01"
  },
  "renewable_resources": {
    "solar": {
      "annual_ghi_kwh_m2": 2100,
      "annual_dni_kwh_m2": 2650,
      "shading_factor": 0.98
    }
  },
  "energy_profile": {
    "annual_consumption_kwh": 500000,
    "annual_generation_kwh": 110000000,
    "peak_demand_kw": 100,
    "base_load_kw": 50,
    "load_factor": 0.5
  },
  "operating_hours": {
    "monday": "24 hours",
    "tuesday": "24 hours",
    "wednesday": "24 hours",
    "thursday": "24 hours",
    "friday": "24 hours",
    "saturday": "24 hours",
    "sunday": "24 hours",
    "holidays": "24 hours automated"
  },
  "contact": {
    "name": "Mike Chen",
    "email": "mike.chen@greenenergy.com",
    "phone": "+1-661-555-0300",
    "role": "Site Manager"
  },
  "commissioning_date": "2021-06-01",
  "status": "active",
  "metadata": {
    "panel_count": 125000,
    "inverter_count": 10,
    "tracker_type": "single_axis",
    "cleaning_frequency": "monthly"
  },
  "created_at": "2021-01-01T08:00:00Z",
  "updated_at": "2025-01-15T10:30:00Z"
}